{
  "$schema": "https://json-schema.org/draft/2020-12/schema",
  "$id": "urn:auditoryworks:axiom:verification:platform-protocol-vector:v1",
  "type": "object", "additionalProperties": false,
  "required": ["format", "formatVersion", "id", "input", "expected"],
  "properties": { "format": { "const": "axiom-platform-protocol-vector-v1" }, "formatVersion": { "const": 1 }, "id": { "type": "string", "pattern": "^HPR-[A-Z0-9-]+$" }, "input": { "type": "object" }, "expected": { "type": "object" } }
}
