{"format":"axiom-platform-protocol-vector-v1","formatVersion":1,"id":"HPR-BOUNDARY-FINAL-07","input":{"requirementStatus":"FREEZE_CANDIDATE","authorityRefs":["IH-06","Platform Harness Execution Protocol v0.1"],"focusAreas":["BOUNDARY/FINAL","reconnect-renegotiate"],"boundaryModes":["IN_PROCESS","OUT_OF_PROCESS"],"setup":{"sessionId":"session:001","sessionEpoch":"u64:0000000000000001","adapterInstanceId":"adapter:scripted:001"},"steps":[{"seq":1,"kind":"SCENARIO","action":"reconnect-renegotiate"}]},"expected":{"oracle":"RENEGOTIATE","terminal":"PASS","assertions":["deterministic-first-divergence","no-partial-mutation"],"diagnosticTextPolicy":"not-compared"}}
